{
  "$schema": "https://json-schema.org/draft/2020-12/schema",
  "$id": "https://colin-prologue/schemas/decision-record/v0.3.0.json",
  "title": "Decision Record",
  "description": "A single decision captured by an agent, a human, or the synthesis/orchestrator layer. Records are the queryable substrate beneath the human-readable DECISIONS.md log; future sessions ground new choices in this corpus instead of re-deriving from first principles.",
  "$comment": "EXPANSION JOINTS — the fields most likely to evolve as the decomposition model settles are `phase`, `level`, `tags`, and `evidence.kind`. These are kept deliberately loose (open strings / extensible enums) so they can grow WITHOUT a breaking schema bump. The structural fields (id, type, status, relationships) are strict on purpose: changing them is a versioned, deliberate act. additionalProperties is false at the root so any genuinely new field forces a schema version bump — that is the 'version the contract, not the implementation' discipline, encoded.",

  "type": "object",
  "additionalProperties": false,
  "required": ["schema_version", "id", "type", "status", "timestamp", "title", "author"],

  "properties": {
    "schema_version": {
      "const": "0.3.0",
      "description": "The contract version this record was written against. Consumers use it to migrate."
    },
    "provenance": {
      "type": "object",
      "additionalProperties": false,
      "description": "Optional link back to the plan task this decision came from, so the timeline view can group decisions by phase/task. Added in 0.2.0; optional, so hand-logged records stay lightweight.",
      "properties": {
        "plan_id": { "type": "string", "pattern": "^PLAN-[0-9]{3,}$" },
        "phase_id": { "type": "string", "pattern": "^PH-[0-9]{1,}$" },
        "task_id": { "type": "string", "pattern": "^(T-[0-9]{1,}|GATE)$" }
      }
    },
    "id": {
      "type": "string",
      "pattern": "^(ADR|HDR|SDR)-[0-9]{3,}$",
      "description": "Stable identifier. Prefix encodes origin: ADR=agent, HDR=human, SDR=synthesis. Must agree with `type` (enforced below)."
    },
    "type": {
      "enum": ["agent", "human", "synthesis"],
      "description": "agent = an executing worker paused, researched, and decided. human = a person's review/annotation. synthesis = a Fable/orchestrator-level choice (decomposition, routing, arbitration)."
    },
    "status": {
      "enum": ["proposed", "pending-review", "approved", "feedback-incorporated", "superseded", "rejected"],
      "description": "Lifecycle. `superseded` matters over multi-year codebases: decisions are revisited, not deleted."
    },
    "confidence": {
      "enum": ["high", "medium", "low"],
      "description": "Agent's self-assessed certainty. Low/medium can gate automatic escalation to human review."
    },
    "timestamp": {
      "type": "string",
      "format": "date-time",
      "description": "ISO 8601. Primary axis for the timeline view."
    },
    "phase": {
      "type": "string",
      "examples": ["spec", "plan", "implementation", "review"],
      "$comment": "EXPANSION JOINT — loose string, not an enum. Add phases freely as the decomposition model evolves."
    },
    "level": {
      "type": "string",
      "examples": ["feature", "component", "function", "task"],
      "$comment": "EXPANSION JOINT — the level-of-resolution axis Colin wants for filtering. Loose by design."
    },
    "tags": {
      "type": "array",
      "items": { "type": "string" },
      "description": "Taxonomy for precedent queries, e.g. ['concurrency','schema-design']. Keep a shared vocabulary so `query by tag` actually retrieves relevant precedent instead of drowning in unrelated decisions.",
      "$comment": "EXPANSION JOINT — the controlled vocabulary lives in convention/docs, not in this schema, so it can grow without a bump."
    },
    "author": { "$ref": "#/$defs/author" },

    "title": {
      "type": "string",
      "maxLength": 140,
      "description": "One-line statement of what was decided. This is the DECISIONS.md index entry."
    },
    "context": {
      "type": "string",
      "description": "Why this decision point arose — the constraint or problem that forced a choice."
    },
    "options": {
      "type": "array",
      "items": { "$ref": "#/$defs/option" },
      "description": "Alternatives genuinely considered. This is the part code can never reconstruct retroactively."
    },
    "chosen": {
      "type": "string",
      "description": "The `name` of the selected option."
    },
    "research": {
      "type": "array",
      "items": { "$ref": "#/$defs/research_note" },
      "description": "Passive research the agent did before deciding — what it explored/tested. Distinct from `reasoning` (what it concluded)."
    },
    "reasoning": {
      "type": "string",
      "description": "The 'why', in plain language. Synthesized for the rich view later; readable by humans now."
    },
    "evidence": {
      "type": "array",
      "items": { "$ref": "#/$defs/evidence" },
      "description": "Proof the decision holds: tests, metrics, diffs, PRs, benchmarks."
    },
    "steelman": {
      "type": "array",
      "description": "PHI-028: the strongest honest case FOR each rejected option, written by the decider. Counters self-justification; required by convention for AgDR-class records (enforced in review, not schema).",
      "items": {
        "type": "object",
        "additionalProperties": false,
        "required": ["option", "strongest_case"],
        "properties": {
          "option": { "type": "string", "description": "Must match an options[].name." },
          "strongest_case": { "type": "string" }
        }
      }
    },
    "blast_radius": {
      "type": "string",
      "description": "PHI-028: what this decision touches and how expensive reversal is — enables async review at the PR gate."
    },

    "depends_on": {
      "type": "array",
      "items": { "type": "string", "pattern": "^(ADR|HDR|SDR)-[0-9]{3,}$" },
      "description": "DAG edges to prior decisions this one builds on. The inverse ('informs') is DERIVED at build time, never stored, to avoid bidirectional drift."
    },
    "supersedes": {
      "type": "array",
      "items": { "type": "string", "pattern": "^(ADR|HDR|SDR)-[0-9]{3,}$" },
      "description": "Decisions this one replaces. Captures the years-long lineage of how thinking evolved."
    },
    "superseded_by": {
      "type": ["string", "null"],
      "pattern": "^(ADR|HDR|SDR)-[0-9]{3,}$",
      "description": "Set when a later decision replaces this one. Old record stays; it is never deleted."
    },

    "feedback": {
      "type": "array",
      "items": { "$ref": "#/$defs/feedback" },
      "description": "The review/evolution trail. A decision is a LIVING artifact: human stamps and later annotations append here, so a reader years on sees the original choice AND how it was refined."
    }
  },

  "allOf": [
    { "if": { "properties": { "type": { "const": "agent" } } },
      "then": { "properties": { "id": { "pattern": "^ADR-" } } } },
    { "if": { "properties": { "type": { "const": "human" } } },
      "then": { "properties": { "id": { "pattern": "^HDR-" } } } },
    { "if": { "properties": { "type": { "const": "synthesis" } } },
      "then": { "properties": { "id": { "pattern": "^SDR-" } } } }
  ],

  "$defs": {
    "author": {
      "type": "object",
      "additionalProperties": false,
      "required": ["kind", "id"],
      "properties": {
        "kind": { "enum": ["model", "human"] },
        "id": { "type": "string", "description": "e.g. 'claude-fable-5', 'claude-haiku-4-5', or a person 'colin'." },
        "role": { "type": "string", "description": "Optional, e.g. 'coder', 'reviewer', 'EM'. Useful audit context at L&W." }
      }
    },
    "option": {
      "type": "object",
      "additionalProperties": false,
      "required": ["name"],
      "properties": {
        "name": { "type": "string" },
        "rationale": { "type": "string" },
        "tradeoff": { "type": "string" }
      }
    },
    "research_note": {
      "type": "object",
      "additionalProperties": false,
      "required": ["action"],
      "properties": {
        "action": { "type": "string", "description": "What the agent investigated, e.g. 'stress-tested both under 10k concurrent users'." },
        "finding": { "type": "string" }
      }
    },
    "evidence": {
      "type": "object",
      "additionalProperties": false,
      "required": ["kind", "ref"],
      "properties": {
        "kind": {
          "type": "string",
          "examples": ["test", "metric", "diff", "pr", "benchmark", "link", "doc"],
          "$comment": "EXPANSION JOINT — loose so new proof types don't need a bump."
        },
        "ref": { "type": "string", "description": "Pointer: test path, commit SHA, PR URL, metric name, etc." },
        "result": { "type": "string", "description": "Outcome, e.g. 'pass', 'memory_overhead_mb: 12', 'no race conditions in 3h'." }
      }
    },
    "feedback": {
      "type": "object",
      "additionalProperties": false,
      "required": ["author", "timestamp", "action", "note"],
      "properties": {
        "author": { "$ref": "#/$defs/author" },
        "timestamp": { "type": "string", "format": "date-time" },
        "action": {
          "enum": ["approve", "revise", "flag", "defer", "supersede"],
          "description": "What the reviewer did. Drives the status transition."
        },
        "note": { "type": "string", "description": "The feedback itself — recorded so the team's evolving judgment is preserved, not lost in a PR thread." }
      }
    }
  }
}
